No,Reddit 스레드 제목,Subreddit,링크
1,World Cup in 4k?,r/youtubetv,https://www.reddit.com/r/youtubetv/comments/ylr7jh/world_cup_in_4k/
2,World Cup 4K PSA,r/youtubetv,https://www.reddit.com/r/youtubetv/comments/yvues3/world_cup_4k_psa/
3,What's the best TV for sports?,r/4kTV,https://www.reddit.com/r/4kTV/comments/1fw5cb0/whats_the_best_tv_for_sports/
4,Any way to watch the World Cup in 4k?,r/canadacordcutters,https://www.reddit.com/r/canadacordcutters/comments/ywlebt/any_way_to_watch_the_world_cup_in_4k/
5,How to watch FIFA World Cup in 4K on TV?,r/hyderabad,https://www.reddit.com/r/hyderabad/comments/z060qy/how_to_watch_fifa_world_cup_in_4k_on_tv/
6,Which channel or TV package will show the FIFA,r/belgium,https://www.reddit.com/r/belgium/comments/yz7rr5/which_channel_or_tv_package_will_show_the_fifa/
7,How to watch World Cup with English commentary?,r/Amsterdam,https://www.reddit.com/r/Amsterdam/comments/yxx9gg/how_to_watch_world_cup_with_english_commentary/
8,On what US streaming service can I watch world cup in full HD?,r/worldcup,https://www.reddit.com/r/worldcup/comments/z6ftsc/on_what_us_streaming_service_can_i_watch_world/
9,FIFA World Cup delivering record-breaking TV audience,r/soccer,https://www.reddit.com/r/soccer/comments/za16nz/fifa_world_cup_delivering_recordbreaking_tv/
10,Best way to watch World Cup from US?,r/worldcup,https://www.reddit.com/r/worldcup/comments/yep76q/best_way_to_watch_world_cup_from_us/
11,How to watch World Cup in 4k?,r/australia,https://www.reddit.com/r/australia/comments/zi9he2/how_to_watch_world_cup_in_4k/
12,4K World Cup Washed Out on Fox Sports App,r/Roku,https://www.reddit.com/r/Roku/comments/z3fh51/4k_world_cup_washed_out_on_fox_sports_app/
13,It's official: Peacock is streaming Women's World Cup in 4K,r/peacock,https://www.reddit.com/r/peacock/comments/155z9h3/its_official_peacock_is_streaming_womens_world/
14,How are you watching the World Cup and what do …,r/LGOLED,https://www.reddit.com/r/LGOLED/comments/z415i7/how_are_you_watching_the_world_cup_and_what_do/
15,What's the best app to stream the World Cup on TV?,r/appletv,https://www.reddit.com/r/appletv/comments/yzgzuq/whats_the_best_app_in_your_opinion_to_stream_the/
16,Best streaming service to watch all World Cup games?,r/ussoccer,https://www.reddit.com/r/ussoccer/comments/y3hw4k/best_streaming_service_to_watch_all_world_cup/
17,Sports look like crap on newer TVs,r/4kTV,https://www.reddit.com/r/4kTV/comments/1ho9ry6/sports_look_like_crap_on_newer_tvs/
18,Watching Club World Cup on DAZN horrible,r/DAZN,https://www.reddit.com/r/DAZN/comments/1lforjg/watching_club_world_cup_on_dazn_horrible/
19,How do you watch sports with good picture quality on a …,r/4kTV,https://www.reddit.com/r/4kTV/comments/zfbro7/how_do_you_watch_sports_with_good_picture_quality/
20,Its 2022 and we still have no 4k sport.,r/australia,https://www.reddit.com/r/australia/comments/yzxsjq/its_2022_and_we_still_have_no_4k_sport/
21,Watching the FIFA World Cup in 4k HDR,r/LGOLED,https://www.reddit.com/r/LGOLED/comments/yxxj2i/watching_the_fifa_world_cup_in_4k_hdr/
22,r/DirectvStream discussions about adding sports channels,r/DirectvStream,https://www.reddit.com/r/DirectvStream/
23,How can I watch the 2026 World Cup on the TV without …,r/SoccerNoobs,https://www.reddit.com/r/SoccerNoobs/comments/1juxnhs/how_can_i_watch_the_2026_world_cup_on_the_tv/
24,How Can I Stream the FIFA World Cup 2026 Without Cable?,r/Alf,https://www.reddit.com/r/Alf/comments/1qe9zqr/how_can_i_stream_the_fifa_world_cup_2026_without/
25,ALL 2026 World Cup games will be on Fubo via FOX,r/fuboinvestors,https://www.reddit.com/r/fuboinvestors/comments/1qmfnvs/all_2026_world_cup_games_will_be_on_fubo_via_fox/
26,FIFA World Cup 2026 Draw – TV & Streaming Info,r/usmnt,https://www.reddit.com/r/usmnt/comments/1pdr9wv/fifa_world_cup_2026_draw_schedule_format_live/
27,Still no 4K Coverage for 2026 World Cup in Australia?,r/Aleague,https://www.reddit.com/r/Aleague/comments/1iur1qx/still_no_4k_coverage_for_2026_world_cup_in/
28,Where to find TV information for World Cup 2026 qualifying games?,r/worldcup,https://www.reddit.com/r/worldcup/comments/17vyoux/where_to_find_tv_information_for_world_cup_2026/
29,FOX Sports announces historic FIFA World Cup 26 coverage – 2026 World Cup,r/ussoccer,https://www.reddit.com/r/ussoccer/comments/1od9q60/fox_sports_announces_historic_fifa_world_cup_26/
30,Will you stay awake to watch World Cup games that are …,r/worldcup,https://www.reddit.com/r/worldcup/comments/1jclj77/will_you_stay_awake_to_watch_world_cup_games_that/
31,SBS scores exclusive FIFA World Cup rights (NZ),r/newzealand,https://www.reddit.com/r/newzealand/comments/1mzin9z/gamechanger_tvnz_scores_exclusive_fifa_world_cup/
32,Should I buy this TV for my parents? – World Cup TV,r/4kTV,https://www.reddit.com/r/4kTV/comments/zco2ow/should_i_buy_this_tv_for_my_parents/
33,Best time to buy a TV? (World Cup context mentioned) – World Cup,r/AskUK,https://www.reddit.com/r/AskUK/comments/1qlknac/would_you_buy_a_tv_now_or_wait_until_april_currys/
34,I miss when Costco TVs would show live TV… buying a TV – World Cup,r/Costco,https://www.reddit.com/r/Costco/comments/1bin0be/i_miss_when_costco_tvs_would_show_live_tv_or/
35,World Cup broadcast rights discussion – Fox/Belgium TV,r/soccer,https://www.reddit.com/r/soccer/comments/1lz6dny/fifa_annual_report_television_broadcasting_rights/
36,Is there any way to legally watch the World Cup without …,r/unitedkingdom,https://www.reddit.com/r/unitedkingdom/comments/8qfo9l/is_there_any_way_to_legally_watch_the_world_cup/
37,Why do people… over TV/World Cup? – "If you never watch TV why did you buy a TV set?",r/AskIreland,https://www.reddit.com/r/AskIreland/comments/1edbdhh/why_do_people_who_dont_watch_rte_or_any_tv/
38,Should I buy a Smart TV now (Prime Big Deal Days) or wait for Black Friday / Christmas / World Cup 2026 deals?,r/askTO,https://www.reddit.com/r/askTO/comments/1o241so/should_i_buy_a_smart_tv_now_prime_big_deal_days/
39,Image quality of World Cup games in 4K UHD on Fox …,r/4kTV,https://www.reddit.com/r/4kTV/comments/z0bwoy/image_quality_of_world_cup_games_in_4k_uhd_on_fox/
40,BBC and ITV opt against bids to televise …,r/soccer,https://www.reddit.com/r/soccer/comments/1jrhd2i/bbc_and_itv_opt_against_bids_to_televise_fifa/
41,Where can I find FIFA World Cup 2026 live stream?,r/usmnt,https://www.reddit.com/r/usmnt/comments/1qd3tcx/where_can_i_find_fifa_world_cup_2026_live_stream/
42,LG C2 – 2022 World Cup – Fox Sports 4K HDR YouTubeTV,r/LGOLED,https://www.reddit.com/r/LGOLED/comments/z0b2fl/lg_c2_2022_world_cup_fox_sports_4k_hdr_youtubetv/
43,30 TVs stream World Cup,r/CommercialAV,https://www.reddit.com/r/CommercialAV/comments/1kqauv5/30_tvs_stream_world_cup/
